{
  "$schema": "http://json-schema.org/draft-07/schema#",
  "title": "design-qa.config.json",
  "description": "Per-repo configuration for the design-qa skill. String values may contain ${ENV_VAR} placeholders, expanded from the environment by scripts/capture.mjs (a missing variable is an error). Unknown keys are reported as warnings by scripts/validate.mjs, not errors.",
  "type": "object",
  "required": ["app", "surfaces"],
  "properties": {
    "$schema": { "type": "string" },
    "app": {
      "type": "object",
      "required": ["baseUrl"],
      "properties": {
        "baseUrl": {
          "type": "string",
          "pattern": "^(https?://|\\$\\{)",
          "errorMessage": "must be an absolute http(s) URL or an environment-variable placeholder (a $ sign followed by {NAME})",
          "description": "Where the app runs, e.g. http://localhost:3000 or ${PREVIEW_URL}."
        },
        "start": { "type": ["string", "null"], "description": "Command that starts the app locally (e.g. npm run dev)." },
        "readyUrl": { "type": "string", "description": "Path or URL polled until the app answers." },
        "auth": {
          "type": "object",
          "required": ["type"],
          "properties": {
            "type": { "enum": ["none", "basic", "cookie", "storageState", "login"] },
            "envPrefix": { "type": "string", "pattern": "^[A-Z_][A-Z0-9_]*$", "default": "DESIGN_QA_APP" },
            "login": {
              "type": ["object", "null"],
              "required": ["url", "userSelector", "passSelector", "submitSelector"],
              "properties": {
                "url": { "type": "string" },
                "userSelector": { "type": "string" },
                "passSelector": { "type": "string" },
                "submitSelector": { "type": "string" },
                "successSelector": { "type": "string" }
              }
            }
          }
        },
        "headers": { "type": "object", "additionalProperties": { "type": "string" } }
      }
    },
    "surfaces": {
      "type": "object",
      "additionalProperties": { "$ref": "#/definitions/surface" }
    },
    "designSystem": {
      "type": "object",
      "properties": {
        "name": { "type": "string" },
        "componentCatalog": { "type": ["string", "null"] },
        "tokenMap": { "type": ["string", "null"] },
        "knownDrifts": { "type": ["string", "null"] },
        "designRules": { "type": ["string", "null"] }
      }
    },
    "tolerances": {
      "type": "object",
      "properties": {
        "px": { "type": "number", "minimum": 0 },
        "colorDeltaE": { "type": "number", "minimum": 0 },
        "pixelDiff": {
          "type": "object",
          "required": ["pass", "review"],
          "properties": {
            "pass": { "type": "number", "minimum": 0, "maximum": 100 },
            "review": { "type": "number", "minimum": 0, "maximum": 100 }
          }
        }
      }
    },
    "commands": {
      "type": "object",
      "properties": {
        "test": { "type": ["string", "null"] },
        "lint": { "type": "array", "items": { "type": "string" } },
        "cwd": { "type": "string" }
      }
    },
    "report": {
      "type": "object",
      "properties": {
        "outDir": { "type": "string" },
        "topN": { "type": "integer", "minimum": 0 },
        "embedImages": { "type": "boolean" },
        "debtLog": {
          "type": "string",
          "pattern": "\\.md$",
          "errorMessage": "must be the path of a Markdown file ending in .md (the JSON log is written next to it)",
          "default": "qa-reports/design-debt.md",
          "description": "Markdown design-debt log written by scripts/debt-log.mjs (the JSON log sits next to it, with .json for .md)."
        },
        "ranking": {
          "type": "object",
          "properties": {
            "severity": {
              "type": "object",
              "properties": {
                "BLOCKER": { "type": "number" },
                "WARNING": { "type": "number" },
                "DS_CANDIDATE": { "type": "number" }
              }
            },
            "ledger": {
              "type": "object",
              "properties": {
                "structure": { "type": "number" },
                "component": { "type": "number" },
                "style": { "type": "number" },
                "state": { "type": "number" },
                "behavior": { "type": "number" },
                "motion": { "type": "number" }
              }
            }
          }
        }
      }
    },
    "ticket": {
      "type": "object",
      "properties": {
        "provider": { "enum": ["jira", "linear", "github", "none"] },
        "baseUrl": { "type": ["string", "null"] },
        "writeBack": { "type": "boolean" },
        "trustPreviewUrl": { "type": "boolean" },
        "debt": {
          "type": "object",
          "description": "Tickets for triaged debt (scripts/jira-fetch.mjs --tickets-from).",
          "properties": {
            "project": { "type": ["string", "null"], "description": "Project key for debt tickets when there is no parent issue." },
            "issueType": { "enum": ["Sub-task", "Task"], "default": "Sub-task" },
            "parent": { "enum": ["auto", null], "default": "auto", "description": "auto: the report's ticket (meta.ticket.key); null: no parent, use project." },
            "labels": { "type": "array", "items": { "type": "string", "pattern": "^\\S+$" }, "default": ["design-qa", "design-debt"] }
          }
        }
      }
    },
    "figma": {
      "type": "object",
      "properties": {
        "access": { "type": "array", "items": { "enum": ["mcp", "devmode-mcp", "rest", "manual"] } }
      }
    },
    "capture": {
      "type": "object",
      "properties": {
        "driver": { "enum": ["script", "playwright-mcp", "builtin"] },
        "reducedMotion": { "type": "boolean" },
        "allowNavigation": { "type": "boolean", "description": "Do not fail states that end on another URL (an app that always redirects, say to a locale prefix or www); same as capture --allow-navigation. A state's own allowNavigation wins." }
      }
    }
  },
  "definitions": {
    "surface": {
      "type": "object",
      "required": ["route"],
      "properties": {
        "route": { "type": "string", "description": "Route template; may contain {id}/{fixture}, replaced by a state's fixture value." },
        "fixture": { "type": ["string", "null"] },
        "fullPage": { "type": "boolean" },
        "figma": {
          "type": "object",
          "required": ["fileKey", "nodeId"],
          "properties": {
            "fileKey": { "type": "string", "minLength": 1 },
            "nodeId": { "type": "string", "minLength": 1 }
          }
        },
        "prototype": {
          "type": ["string", "null"],
          "pattern": "^(https?://|file:|\\$\\{)",
          "errorMessage": "must be an http(s) or file: URL or an environment-variable placeholder (a $ sign followed by {NAME})",
          "description": "Prototype URL used as the design source of truth: a Figma prototype (figma.com/proto/...) or a coded prototype (Figma Make, Framer, v0, Lovable, static HTML, localhost). capture.mjs --side design captures it."
        },
        "screens": {
          "type": "object",
          "description": "Multi-screen surface: one entry per screen id (kebab-case, as in figma-fetch --screens auto). Each screen is captured with --screen <id> into evidence/screens/<id>.",
          "additionalProperties": { "$ref": "#/definitions/screen" }
        },
        "states": { "type": "object", "additionalProperties": { "$ref": "#/definitions/driver" } }
      }
    },
    "screen": {
      "type": "object",
      "properties": {
        "name": { "type": "string" },
        "figma": { "type": ["string", "null"], "description": "Figma link (design or proto) of this screen's frame." },
        "prototype": {
          "type": ["string", "null"],
          "pattern": "^(https?://|file:|\\$\\{)",
          "errorMessage": "must be an http(s) or file: URL or an environment-variable placeholder (a $ sign followed by {NAME})",
          "description": "Coded prototype URL of this screen."
        },
        "route": { "type": "string", "description": "App route of this screen (relative to app.baseUrl, or absolute)." }
      }
    },
    "driver": {
      "type": "object",
      "description": "How to put the app into one state before capture. All keys optional; an empty object means the default render.",
      "properties": {
        "fixture": { "type": "string", "description": "Replaces {fixture}/{id} in the route, otherwise appended as ?fixture=<value>." },
        "query": { "type": "string", "description": "Query string merged into the URL, e.g. ?state=empty or state=empty." },
        "mock": {
          "type": "object",
          "required": ["urlPattern"],
          "properties": {
            "urlPattern": { "type": "string", "minLength": 1, "description": "Playwright glob, e.g. **/api/items*" },
            "status": { "type": "integer", "minimum": 100, "maximum": 599 },
            "body": {},
            "delayMs": { "type": "integer", "minimum": 0 },
            "contentType": { "type": "string" }
          }
        },
        "storage": {
          "type": "object",
          "properties": {
            "local": { "type": "object" },
            "session": { "type": "object" }
          }
        },
        "action": { "enum": ["hover", "focus", "active", "click", "keyboard"] },
        "selector": { "type": "string", "minLength": 1 },
        "keys": { "type": "string", "description": "Keys for action keyboard, space separated (Playwright names, e.g. Tab Tab Enter or Shift+Tab)." },
        "settleMs": { "type": "integer", "minimum": 0 },
        "viewport": {
          "type": "object",
          "required": ["width", "height"],
          "properties": {
            "width": { "type": "integer", "minimum": 1 },
            "height": { "type": "integer", "minimum": 1 }
          }
        },
        "reducedMotion": { "type": "boolean" },
        "wait": { "type": "string", "description": "Selector to wait for in this state (overrides capture --wait)." },
        "allowNavigation": { "type": "boolean", "description": "The state may end on another URL (an action that navigates); otherwise a redirect or navigation away fails the state." },
        "source": { "type": "string", "description": "Implemented in code but not drivable at runtime (file reference); the state is reported as CANNOT_VERIFY." }
      }
    }
  }
}
